Title,Price,Availability,Reviews
Wedding Journal- The Sheet Box | Wedding Journal for bride | Indian Wedding Planner | Marriage Planner Book | Engagement Gift | Plan Your Wedding | Wedding Planner Organiser [Hardcover] (BROWN),Price Not Available,In stock,No Reviews
இனிய இல்லறமும் குடும்ப ஆலோசனையும் (Tamil Edition),0,Availability Not Shown,4.8 out of 5 stars
"The Art of Being Alone: Loneliness Was My Cage, Solitude Is My Home (English)",189,In stock,4.4 out of 5 stars
Don't Believe Everything You Think (English),190,In stock,4.5 out of 5 stars
"The Art of Letting Go: Move Beyond the Hurt, Find Emotional Freedom and Restore Your Inner Peace",159,In stock,4.4 out of 5 stars
Dopamine Detox : A Short Guide to Remove Distractions and Get Your Brain to Do Hard Things,199,In stock,4.4 out of 5 stars
SPIRITUAL AWAKENING SHRI HIT PREMANAND GOVIND SHARAN JI MAHARAJ VOLUME 1 (PB 2024),269,In stock,5.0 out of 5 stars
The Alchemist,258,In stock,4.6 out of 5 stars
The Theory Of Everything,185,In stock,4.5 out of 5 stars
THE BLUE UMBRELLA,123,In stock,4.5 out of 5 stars
Autobiography of a Yogi (Complete Original Edition),109,In stock,4.6 out of 5 stars
"Read People Like a Book: How to Analyze, Understand, and Predict People’s Emotions, Thoughts, Intentions, and Behaviors",289,In stock,4.3 out of 5 stars
"The Science of Self-Discipline: The Willpower, Mental Toughness and Self-Control to Resist Temptation and Achieve Your Goals",289,In stock,4.5 out of 5 stars
Who Will Cry When You Die?,197,In stock,4.4 out of 5 stars
"Story Books for Kids - Second Reader (Illustrated) (Set of 6 Books) - Phonic stories - Bedtime Stories - 3 Years to 6 Years Old - Read Aloud to Infants, Toddlers",150,In stock,4.4 out of 5 stars
The Monk Who Sold His Ferrari,219,In stock,4.5 out of 5 stars
Mandala Art: Colouring books for Adults with tear out sheets,199,In stock,4.5 out of 5 stars
"How To Trade In Stocks | Jesse Livermore | English Money Book | Jesse Livermore's Methods of Trading Books | Reminiscences of a Stock Operator & | to in the zone intelligent investor market | chart pattern technical analysis | financial markets by | price action share for beginners | wizards option make | benjamin graham | common and uncommon profits | simple investing like journal intraday investment fundamental | i made 2,000,000 breakout crash course | five rules successful coffee can value behavioral | finance thoughtful security | easy swing 51 strategy | zebra dhandho options | riches day attention | volatility pricing future smart concept learn | what learned about from darwin mastermind 10 on poster Hindi",133,In stock,4.4 out of 5 stars
One Arranged Murder,181,In stock,4.3 out of 5 stars
As A Man Thinketh by James Allen [Premium Paperback] |Philosophy & Human Psychology Book for Personal Growth | Self Help to Think Better Thoughts | Self Improvement Book | The Art Of Contrary Thinking,119,In stock,5.0 out of 5 stars
THE RUDEST BOOK EVER : Powerful Perspectives to Free Your Mind,325,In stock,4.4 out of 5 stars
Intellectual Trust in Oneself and Others,"2,292",In stock,No Reviews
